{
  "schema_version": 1,
  "id": "existing-product",
  "asset_sets": ["product-core", "foundation-strategy", "knowledge", "delivery-domains", "delivery-design", "delivery-engineering", "governance"],
  "directories": [],
  "files": [
    {
      "source": "framework/skills/product-orchestrator/assets/product-baseline-template.md",
      "target": "foundation/product-baseline.md",
      "replacements": {
        "[PRODUCT-BASELINE-XXX]": "PRODUCT-BASELINE-TBD",
        "[draft | proposed | approved]": "draft"
      }
    }
  ],
  "patches": [
    {
      "target": "context.md",
      "find": "Do not create domains or features until `foundation/problem/problem.md`, `foundation/vision/vision.md`, and `foundation/strategy/strategy.md` contain product-specific content.",
      "replace": "For `existing-product`, approve `foundation/product-baseline.md` from repository and operational evidence, then approve `foundation/strategy/strategy.md` before creating delivery work."
    }
  ],
  "registry": {
    "modules": ["product-core", "foundation-baseline", "foundation-strategy", "knowledge", "delivery-domain", "delivery-design", "delivery-engineering", "governance"],
    "required_artifacts": [
      {"type": "product-baseline", "path": "foundation/product-baseline.md"},
      {"type": "strategy", "path": "foundation/strategy/strategy.md"}
    ],
    "exclude_types": ["problem", "vision", "product-principles", "north-star"],
    "prepend_artifacts": [
      {
        "id": "PRODUCT-BASELINE-TBD",
        "type": "product-baseline",
        "status": "draft",
        "path": "foundation/product-baseline.md",
        "parentIds": []
      }
    ],
    "replace_parents_by_type": {
      "strategy": ["PRODUCT-BASELINE-TBD"]
    }
  },
  "bootstrap_profile": "existing-product",
  "actions": []
}
