{
  "schema_version": 1,
  "id": "new-product",
  "asset_sets": ["product-core", "foundation-problem", "foundation-vision", "foundation-strategy", "knowledge", "delivery-domains", "delivery-design", "delivery-engineering", "governance"],
  "directories": [],
  "files": [],
  "patches": [],
  "registry": {},
  "bootstrap_profile": "new-product",
  "actions": []
}
