{
  "schema_version": 1,
  "id": "existing-feature",
  "asset_sets": ["product-core", "knowledge", "delivery-domains", "governance"],
  "directories": [],
  "files": [
    {
      "source": "framework/skills/product-orchestrator/assets/feature-brief-template.md",
      "target": "foundation/feature-brief.md",
      "replacements": {
        "# Feature Brief: [feature name]": "# Feature Brief",
        "[FBR-XXX]": "FEATURE-BRIEF-TBD",
        "[draft | proposed | approved]": "draft",
        "[FT-XXX or product-relative feature path]": "FT-TEMPLATE"
      }
    }
  ],
  "patches": [
    {
      "target": "context.md",
      "find": "Do not create domains or features until `foundation/problem/problem.md`, `foundation/vision/vision.md`, and `foundation/strategy/strategy.md` contain product-specific content.",
      "replace": "For `existing-feature`, complete and approve `foundation/feature-brief.md` before creating a workspace. Escalate to full Foundation when the work requires product-wide direction."
    }
  ],
  "registry": {
    "modules": ["product-core", "foundation-feature", "knowledge", "delivery-domain", "governance"],
    "required_artifacts": [{"type": "feature-brief", "path": "foundation/feature-brief.md"}],
    "exclude_types": ["problem", "vision", "product-principles", "north-star", "strategy"],
    "prepend_artifacts": [
      {
        "id": "FEATURE-BRIEF-TBD",
        "type": "feature-brief",
        "status": "draft",
        "path": "foundation/feature-brief.md",
        "parentIds": [],
        "targetFeature": "FT-TEMPLATE"
      }
    ],
    "append_parents_by_type": {
      "feature": ["FEATURE-BRIEF-TBD"]
    }
  },
  "bootstrap_profile": "existing-feature",
  "actions": []
}
